pct,name,addr,postcode,email
Coventry Teaching PCT,Park Leys Medical Practice,"Keresley Green Medical Centre Bennetts Road South, Keresley Coventry West Midlands CV6 2FL",CV6 2FL,admin@parkleyspractice.com
Derbyshire County PCT,Dr SPENCER & Partners,Welbeck Road Health Centre 1b Welbeck Road Bolsover Chesterfield Derbyshire S44 6DF,S44 6DF,general.drspencer@nhs.net
Hampshire PCT,Dr H J L Morris And Partners,The Fordingbridge Surgery Bartons Road Fordingbridge Hampshire SP6 1RS,SP6 1RS,hamp-pct.fordingbridgesurgery@nhs.net
Norfolk PCT,Hingham Surgery,Hardingham Street Hingham Norwich Norfolk NR9 4JB,NR9 4JB,hinghamsurgery@nhs.net
South Staffordshire PCT,Fulfen Practice,Burntwood Health Centre Hudson Drive Burntwood Staffordshire WS7 0EW,WS7 0EW,fulfen.practice@nhs.net
Devon PCT,BAMPTON SURGERY,Barnhay Bampton Devon EX16 9NB,EX16 9NB,reception@bamptonsurgery.co.uk
Gloucestershire PCT,Dr M Nicholas & Partners,The Leckhampton Surgery 17 Moorend Park Road Cheltenham Gloucestershire GL53 0LA,GL53 0LA,Leckhampton.Recept@glos.nhs.uk
Brent Teaching PCT,CHURCH END MEDICAL CENTRE ,"Church End Medical Centre 66 Mayo Road Church End Estate Willesden, London NW10 9HP",NW10 9HP,bre-pct.cemc@nhs.net
Northamptonshire Teaching PCT,Long Buckby Practice,24 Station Road Long Buckby Northamptonshire NN6 7QB,NN6 7QB,longbuckby.practice@gp-K83019.nhs.uk
South Staffordshire PCT,Dr H.S Dhingra & Dr H.S. Grewal,"Tamar Medical Centre Severn Drive, Perton Wolverhampton Staffordshire WV6 7QL",WV6 7QL,tamarmedical-centre@nhs.net
Wandsworth PCT,M H Khan,78 Granville Road Southfields London SW18 5SG,SW18 5SG,shafkat.khokhar@nhs.net
Barnet PCT,Grovemead Health Centre,Grovemead Health Centre 67 Elliot Road Hendon London NW4 3EB,NW4 3EB,Grovemead.Health@NHS.Net
Leeds PCT,Dr O'shea T S & Partners,Hyde Park Surgery Woodsley Road Leeds LS6 1SG,LS6 1SG,hydeparksurgery@nhs.net
Bristol PCT,Fishponds Family Practice,Fishponds Family Practice Beechwood Road Fishponds Bristol BS16 3TD,BS16 3TD,enquiries@thefishpondsfamilypractice.nhs.uk
Tameside and Glossop PCT,Market Street Medical Practice ,76 Market Street Droylsden Manchester Lancashire M43 6DE,M43 6DE,marketstreetmedicalpractice@nhs.net
Stockport PCT,Wilmslow Road Medical Centre,166 Wilmslow Road Handforth Wilmslow Cheshire SK9 3LF,SK9 3LF,WRCH@gp-P88025.nhs.uk
Isle Of Wight NHS PCT,Ventnor Medical Centre,Ventnor Medical Centre 3 Albert Street Ventnor Isle Of Wight PO38 1EZ,PO38 1EZ,ventnor@gp-j84003.nhs.uk
Doncaster PCT,Petersgate Medical Centre, 99 Amersall Road Scawthorpe Doncaster South Yorkshire DN5 9PQ,DN5 9PQ,lesley.wilton@gp-c86038.nhs.uk or ruth.price@gp-c86038.nhs.uk
Derbyshire County PCT,PARMAR VP,1 Hallcroft Avenue Overseal Swadlincote Derbyshire DE12 6JF,DE12 6JF,enquiries@oversealsurgery.co.uk
Bristol PCT,Students' Health Service,Students' Health Service Hampton House Health Centre St. Michael's Hill Bristol BS6 6AU,BS6 6AU,admin@gp-L81133.nhs.uk
Mid Essex PCT,Dr Brann & Partners,"Sidney House, Strutt Close Hatfield Peverel Chelmsford Essex CM3 2HB",CM3 2HB,Sidney.Laurels@gp-f81149.nhs.uk
South Staffordshire PCT,Peel Croft Surgery,Lichfield Street Burton-on-Trent Staffs DE14 3RH,DE14 3RH,peel.croft@sshawebmail.nhs.uk
West Essex PCT,"The Eden Surgeries, Hatfield Broad Oak",17 Cannons Lane Hatfield Broad Oak Bishop's Stortford Herts CM22 7HX,CM22 7HX,Lesley.Linford@nhs.net
Croydon PCT,Forestdale Surgery,125 Holmbury Grove Featherbed Lane Croydon Surrey CR0 9AQ,CR0 9AQ,http://www.farleymedical.co.uk
Surrey PCT,Orchards Surgery,The Orchard Surgery 107 Feltham Hill Road Ashford Middlesex TW15 1HH,TW15 1HH,kandelasurgery@aol.com
Great Yarmouth and Waveney PCT,Rosedale Surgery,Ashburnham Way Carlton Colivlle Lowestoft Suffolk NR33 8LG,NR33 8LG,gyw-pct.rosedaleadmin@nhs.net
Portsmouth City Teaching PCT,Campbell Surgery,Campbell Surgery 2a Campbell Road Southsea Hampshire PO5 1RN,PO5 1RN,mikejefferies@nhs.net
Norfolk PCT,Dr O'Neill,205 Holt Road Horsford Norwich Norfolk NR10 3DX,NR10 3DX,rachel.davey@nhs.net
Halton and St Helens PCT,Hough Green Health Park,Hough Green Road Widnes Cheshire WA8 4NJ,WA8 4NJ,bernie.mitchell@nhs.net
South Staffordshire PCT,Dr L H Bryan & Partners,Planks Lane Wombourne Wolverhampton WV5 8DX,WV5 8DX,wombourne.surgery@sshawebmail.nhs.web
Knowsley PCT,LONGVIEW PRIMARY CARE CENTRE,Longview Drive Liverpool Merseyside L36 6EB,L36 6EB,longviewmedicalcentre.co.uk
Sandwell PCT,New Street Surgery,New Street Surgery New Street Hill Top West Bromwich West Midlands B70 0HN,B70 0HN,M88035general'nhs.net
Somerset PCT,Somerset Bridge Medical Centre,Stockmoor Park Taunton Road Bridgwater Somerset TA6 6LD,TA6 6LD,xandie.sealey@redgatemedicalcentre.nhs.uk
Suffolk PCT,The Christmas Maltings and Clements Practice - Kedington Surgery,36 School Road Kedington Suffolk CB9 7NG,CB9 7NG,marion.mclaine@gp-d83012.nhs.uk
Wolverhampton City PCT,Dr M S KAINTH,Primrose Lane Health Ctr Primrose Lane Low Hill Wolverhampton WV10 8RN,WV10 8RN,primroselanesurgery@wolvespct.nhs.uk
Oxfordshire PCT,"The Health Centre, Bicester",The Health Centre Coker Close Bicester Oxfordshire OX26 6AT,OX26 6AT,bicester.hc@nhs.net
Gloucestershire PCT,Gloucester Health Access Centre,Eastgate House Eastgate Street Gloucester Glos GL1 1PX,GL1 1PX,info.ghac@glos.nhs.uk
Derby City PCT,Chellaston Medical Centre,Rowallan Way Chellaston Derby Derbyshire DE73 5BG,DE73 5BG,reception.chellastonsurgery@nhs.net
Northamptonshire Teaching PCT,Bugbrooke Medical Centre,Levitts Road Bugbrooke Northamptonshire NN7 3QN,NN7 3QN,valerie.skidmore@gp-k83070.nhs.uk
West Kent PCT,Dr Dewing C R & Partner,The Surgery Wish Valley Talbot Road Hawkhurst Kent TN18 4NB,TN18 4NB,sharongrant@nhs.net
Worcestershire PCT,Bewdley Medical Centre,Bewdley Medical Centre Dog Lane Bewdley Worcestershire DY12 2EG,DY12 2EG,bmcinfo@nhs.net
Eastern and Coastal Kent PCT,Dr A Weatherley & Partner,7 The Butchery Sandwich Kent CT13 9DL,CT13 9DL,eck-pct.thebutchery@nhs.net
Somerset PCT,Wellington Medical Centre (Dr Bevan & Partners),Wellington Medical Centre Mantle Street Wellington Somerset TA21 8BD,TA21 8BD,Reception.Office@wellingtonmc.nhs.uk
West Sussex PCT,Dolphins Practice,The Nightingale Primary Care Centre Butlers Green Road Haywards Heath West Sussex RH16 4BN,RH16 4BN,ws-pct.dolphins-admin@nhs.net
Gloucestershire PCT,Dr Foster WH & Partners,Saintbridge Surgery Askwith Road Saintbridge Gloucester GL4 4SH,GL4 4SH,Saintbridge.Admin@glos.nhs.uk
Oxfordshire PCT,Summertown Group Practice,Summertown Health Centre 160 Banbury Road Oxford OX2 7BS,OX2 7BS,summertownhc@nhs.net
County Durham PCT,Fletcher & Partners,Front Street Great Lumley Chester-le-Street Co. Durham DH3 4LE,DH3 4LE,Elizabethsimpson2@nhs.net
Northamptonshire Teaching PCT,King Edward Road Surgery,King Edward Road Christchurch Medical Centre Northampton Northants NN1 5LY,NN1 5LY,visitor@gp-k83012.nhs.uk
Derby City PCT,GOULD ADW,1217 London Road Alvaston Derby Derbyshire DE24 8QJ,DE24 8QJ,sue.knott@nhs.net
Bromley PCT,Dr HARRISON & partners,Beckenham Beacon 379 Croydon Road Beckenham Kent BR3 3FD,BR3 3FD,susan.reeves@gp-g84027.nhs.uk
Somerset PCT,Highbridge Medical Centre,Pepperall Road Somerset Highbridge TA9 3YA,TA9 3YA,generalenquiries@highbridgemc.nhs.uk
East Lancashire Teaching PCT,The Richmond Hill Practice,Colne Health Centre Market Street Colne Lancashire BB8 0LJ,BB8 0LJ,repeats.p81025@nhs.net
Sutton and Merton PCT,The Church Lane Practice,2 Church Lane Merton Park London SW19 3NY,SW19 3NY,enquiries.churchlanesurgery@nhs.net
Warrington PCT,Eric Moore Partnership Medical Practice,Eric Moore Health Centre 1 Tanners Lane Bewsey Warrington WA2 7LY,WA2 7LY,lisamoffat@nhs.net
Mid Essex PCT,Baddow Village Surgery,Longmead Avenue Great Baddow Chelmsford Essex CM2 7EZ,CM2 7EZ,sue.finch@gp-f81114.nhs.uk
Manchester PCT,The Jolly Medical Centre,72/74 Crescent Road Crumpsall Manchester M8 9NT,M8 9NT,elizabeth.haigh@nhs.net
Oxfordshire PCT,Sheep Street Surgery Burford,Carterton Health Centre 17 Alvescot Road Carterton OX18 3LJ,OX18 3LJ,simon.albert@burfordsurgery.co.uk
South West Essex PCT,The Sorrells Surgery,7 The Sorrells Stanford-le-Hope Essex SS17 7DZ,SS17 7DZ,practice.managerf81697@nhs.net
Milton Keynes PCT,Walnut Tree Health Centre,2 Blackberry Court Walnut Tree Milton Keynes Bucks MK7 7NR,MK7 7NR,www.walnuttreehealthcentre.co.uk
South West Essex PCT,Primecare Medical Centre,167 Bridge Road Grays Essex RM17 6DB,RM17 6DB,pmc.admin@nhs.net
West Sussex PCT,Middleton Medical Centre,Elmer Road Middleton-on-Sea Bognor Regis West Sussex PO22 7SR,PO22 7SR,Jerry.Nelson@nhs.net
Sheffield PCT,Mill Road Surgery,98a Mill Road Ecclesfield Sheffield S Yorkshire S35 9XQ,S35 9XQ,Angi.Hartley@nhs.net
Croydon PCT,Dr J W Gillgrass & Partners,The Birdhurst Medical Practice 1 Birdhurst Avenue South Croydon Surrey CR2 7DX,CR2 7DX,hazel.goodbody@gp-h83627.nhs.uk
Surrey PCT,Lantern Surgery,Lantern Surgery 3 Station Approach Hinchley Wood Surrey KT10 0SP,KT10 0SP,see our website for email @ contact details
Stockport PCT,The Surgery (Azmy),30 Brinnington Road Portwood Brinnington Stockport Cheshire SK1 2EX,SK1 2EX,thesurgery@drazmy.com
Herefordshire PCT,St Katherine's Surgery,Market Street Ledbury Herefordshire HR8 2AQ,HR8 2AQ,stkatherinessurgery@nhs.net
Sutton and Merton PCT,The Church Lane Practice - Patrick Doody Clinic,Patrick Doody Clinic 79 Pelham Road Wimbledon London SW19 1NX,SW19 1NX,enquiries.churchlanesurgery@nhs.net
Dorset PCT,LYME REGIS MEDICAL CENTRE,Lyme Regis Medical Centre Uplyme Road Lyme Regis Dorset DT7 3LS,DT7 3LS,alison.robinson@dorset.nhs.uk
Norfolk PCT,Dr Edmonds & Partners - UEA Medical Centre,University of East Anglia Earlham Road Norwich Norfolk NR4 7TJ,NR4 7TJ,umsuea@nhs.net
Central Lancashire PCT,Beacon Primary Care - Hillside Health Centre,Dr S Biswas And Partners Hillside Health Centre Tanhouse Road Tanhouse Skelmersdale WN8 6DS,WN8 6DS,admin@beaconprimarycare.org.uk
Croydon PCT,Woodcote Group Practice (Purley),32 Foxley Lane Purley Surrey CR8 3EE,CR8 3EE,woodcote.practice@gp-h83024.nhs.uk
Derbyshire County PCT,Arden House Medical Practice Sett,Sett Close New Mills High Peak Derbyshire SK22 4AQ,SK22 4AQ,surgery.ardenhouse@nhs.net
Doncaster PCT,The Burns Medical Practice DN1 2EG,4 Albion Place Bennetthorpe Doncaster DN1 2EG,DN1 2EG,reception@gp-c86007.nhs.uk
Shropshire County PCT,Marysville Medical Practice,Marysville Medical Practice Brook Street Belle Vue Shrewsbury SY3 7QR,SY3 7QR,mp.marysville@nhs.net
Kirklees PCT,Birkby Health Centre,37 Norwood Road Huddersfield W Yorkshire HD2 2YD,HD2 2YD,Manohar.Singh@GP-B85634.nhs.uk
Harrow PCT,THE RIDGEWAY SURGERY Dr LLOYD & partners,71 Imperial Drive Harrow Middx Middlesex HA2 7DU,HA2 7DU,scripts@gp-E84068.nhs.uk
Newcastle PCT,Dr Grainger & Partners,"Throckley Primary Care, Tillmouth Park Road Throckley Newcastle Upon Tyne NE15 9PA",NE15 9PA,throckleyreception.a8602@nhs.net
Leicester City PCT,SSAFA Care CIC Health & Walk In Centre,The Merlyn Vaz Health & Social Care Centre 1 Spinney Hill Road Leicester Leicestershire England - Uk LE5 3GH,LE5 3GH,Lisa.Phillips@gp-y02469.nhs.uk
Norfolk PCT,Long Stratton Medical Partnership,Swan Lane Surgery Swan Lane Tharston Norfolk NR15 2UY,NR15 2UY,long.stratton@nhs.net 
Somerset PCT,Lister House Surgery,Bollams Mead Wiveliscombe Taunton Somerset TA4 2PH,TA4 2PH,info@wiveliscombesurgery.nhs.uk
North Lincolnshire PCT,Dr Kennedy & Partners,291 Ashby Road Scunthorpe DN16 2AB,DN16 2AB,nl.b81026@nhs.net
Berkshire East PCT,Dr Hutchings & Partners,8a Ray Park Avenue Maidenhead Berks SL6 8DS,SL6 8DS,rosemeadsurgery@nhs.net
Westminster PCT,Half Penny Steps Health Centre,427-429 Harrow Road London W10 4RE,W10 4RE,halfpennysteps@nhs.net
Warwickshire PCT,St Wulfstan Surgery,Northfield Road Southam Warks CV47 0FG,CV47 0FG,via the website
Devon PCT,Christow Branch Surgery,Layne Fields Christow Devon EX6 7NY,EX6 7NY,cheritonbishopsurgery@nhs.net
Barnsley PCT,The Kakoty Practice Worsbrough,"Mount Pleasant, West Street Worsbrough Barnsley South Yorkshire S70 5NZ",S70 5NZ,safehaven.c85009.nhs.uk
Dudley PCT,Dr Rathore Js,Castle Meadows Surgery 100 Milking Bank Dudley West Midlands DY1 2TY,DY1 2TY,CastleMeadows.Surgery@dudley.nhs.uk
Lincolnshire Teaching PCT,Dr Woollard And Partners,Merton Lodge Surgery West Street Alford Lincs LN13 9HT,LN13 9HT,feedback.alforddocs@nhs.net
"Ashton, Leigh and Wigan PCT",Platt House Surgery,Rivington Avenue Platt Bridge Wigan Lancs WN2 5NG,WN2 5NG,katie.heyes@gp92031.nhs.uk
North Lincolnshire PCT,West Common Lane Teaching Practice,Dorchester Road Scunthorpe DN17 1YH,DN17 1YH,Wendy.High@gp-b81118.nhs.uk
Kirklees PCT,Meltham Group Practice,1 The Cobbles Meltham Holmfirth W Yorkshire HD9 5QQ,HD9 5QQ,Doctors@gp-B85032.nhs.uk
South West Essex PCT,Dr H S Rao,Wickford Avenue Basildon Essex SS13 3HQ,SS13 3HQ,hinonavis.rao@nhs.net
Sandwell PCT,Hill Top Medical Centre,Hill Top Medical Centre 15 Hill Top Road Oldbury West Midlands B68 9DU,B68 9DU,sue.lawrence@nhs.net
Ealing PCT,"Dr Khan, MA",Horn Lane Surgery 156 Horn Lane Acton London W3 6PH,W3 6PH,admin.hornlanesurgery@nhs.net
Newcastle PCT,The Gateway Practice,45 Scrogg Road Walker Newcastle upon Tyne England - UK NE6 4EY,NE6 4EY,ncs-pct.Gateway-Practice@nhs.net
Liverpool PCT,EVERTON ROAD HEALTH CENTRE,45 Everton Road Liverpool Merseyside L6 2EH,L6 2EH,Carolyn.Brennan@gp-n82665.nhs.uk
Warrington PCT,Dr Banyard PJ and Partners,Springfields Medical Centre Bath Street Health and Wellbeing Centre Legh Street Warrington Cheshire WA1 1UG,WA1 1UG,war-pct.springfieldsMC@nhs.net
Coventry Teaching PCT,City of Coventry NHS Walk-in and Healthcare Centre,Stoney Stanton Road Coventry England - Uk CV1 4FS,CV1 4FS,gary.empsall@assurallp.co.uk
County Durham PCT,Dr Ferguson & Partners,27 Bewick Crescent Newton Aycliffe Co Durham DL5 5LH,DL5 5LH,helen.hobson@nhs.net
Waltham Forest PCT,Dr S Cooney - Addison Road Medical Practice,Addison Road Medical Practice Comely Bank Clinic 46 Ravenswood Road Walthamstow E17 9LY,E17 9LY,gpsurgery.addisonroad@nhs.net
Doncaster PCT,St John's Group Practice,St.Johns Group Practice Greenfield Lane Balby Doncaster DN4 0TH,DN4 0TH,reception@gp-c86020.nhs.uk
South Gloucestershire PCT,Courtside Surgery,Kennedy Way Yate Bristol BS37 4DQ,BS37 4DQ,postmaster@gp-L81024.nhs.uk
Western Cheshire PCT,Dr Milroy P J M and Partners - Brookside Surgery,Brookside Surgery Kingsley Warrington Cheshire WA6 8AR,WA6 8AR,knoll.surgery@nhs.net
Bolton PCT,"Unsworth Group Practice, Blackrod",Blackrod Health Centre Church Street Blackrod Bolton Lancs BL6 5EQ,BL6 5EQ,BL53UB
Buckinghamshire PCT,Desborough Surgery ( Main Surgery ),65 Desborough Avenue High Wycombe Buckinghamshire HP11 2SD,HP11 2SD,desborough.surgery@nhs.net
Telford and Wrekin PCT,Ironbridge Medical Practice,Ironbridge Medical Practice Trinity Hall Dale Road Coalbrookdale Telford Shropshire TF8 7DT,TF8 7DT,ironbridge.mp@nhs.net
Warwickshire PCT,Dr Jaques & partners,Henley-In-Arden Med Ctr Prince Harry Road Henley-In-Arden Solihull B95 5GD,B95 5GD,amand.taylor@henleymc.nhs.uk
Kensington and Chelsea PCT,The Portland Road Practice,16 Portland Road London W11 4LA,W11 4LA,portlandroad.surgery2@nhs.net
Liverpool PCT,MERSEY VIEW SURGERY,45 Everton Road Liverpool England - Uk L6 2EH,L6 2EH,enquiries.merseyviewsurgery@nhs.net
Gateshead PCT,Dr M S Hassan,South Road Chopwell Tyne and Wear NE17 7BU,NE17 7BU,roshan.hassan@gp.a85024.nhs.uk
Dorset PCT,Dorchester Road Surgery,179 Dorchester Road Weymouth Dorset DT4 7LE,DT4 7LE,Giovanna.Davidson@gp-J81613.nus.uk
Sefton PCT,Dr P SHARMA.,168 Liverpool Road Great Crosby Liverpool Merseyside L23 0QW,L23 0QW,NONE
Redcar and Cleveland PCT,Woodside Surgery at Carlin How Clinic,"The Clinic, Brotton Road Carlin How Saltburn-By-The-Sea TS13 4DY",TS13 4DY,alison.king@nhs.net
South Staffordshire PCT,Brewood Medical Practice,Sandy Lane Brewood Stafford Staffordshire ST19 9ES,ST19 9ES,brewoodsurgery@nhs.net 
Rotherham PCT,Dalton Health Centre,Magna Lane Dalton Rotherham S Yorkshire S65 4HH,S65 4HH,Steve.Hindle@gp-C87006.nhs.uk
Stockton-on-Tees Teaching PCT,Woodlands Family Medical Centre,106 Yarm Lane Stockton On Tees Cleveland TS18 1YE,TS18 1YE,marilyn.maclean@gp-A81046.nhs.uk
Suffolk PCT,The Chesterfield Drive Practice,The Surgery 29 Chesterfield Drive Ipswich Suffolk IP1 6DW,IP1 6DW,admin@gp-d83039.nhs.uk
Leeds PCT,City View Medical Practice,Beeston Hill Community Health Centre 123 Cemetery Road Leeds West Yorkshire LS11 8LH,LS11 8LH,lynneknight@nhs.net
Calderdale PCT,Lister Lane Surgery,30 Lister Lane Halifax W Yorkshire HX1 5AX,HX1 5AX,reception@listerlanesurgery.co.uk
Somerset PCT,Berrow Medical Centre,Berrow Health Campus Brent Road Burnham-on-Sea Somerset TA8 2JU,TA8 2JU,terri.huxtable@burnhammc.nhs.uk
South Birmingham PCT,Highfield House,88 Highfield Lane Woodgate Valley Birmingham B32 1QX,B32 1QX,info.ridgacrehousesbpct@nhs.net
Norfolk PCT,Rockland Surgery,The Street Rockland St Mary Norwich Norfolk NR14 7AH,NR14 7AH,mail.heathgate@nhs.net
Herefordshire PCT,Cradley Surgery,Bosbury Road Cradley Malvern Worcestershire WR13 5LT,WR13 5LT,cradleysurgery@nhs.net
Hertfordshire PCT,Dr A M Khan,12 Catherine Place Off College Road Abbots Langley WD5 0BT,WD5 0BT,mashkoor.khan@nhs.net
South Birmingham PCT,Grange Hill Surgery,Grange Hill Surgery 41 Grange Hill Road Kings Norton Birmingham West Midlands B38 8RF,B38 8RF,info@grangehillsurgery.co.uk
Redcar and Cleveland PCT,Zetland Medical Practice - Saltburn-By-The-Sea,2 Windsor Road Saltburn-By-The-Sea Cleveland TS12 1BH,TS12 1BH,les.boyd@nhs.net
North East Essex PCT,Green Elms Health Centre,32 Crossways Jaywick Clacton-on-Sea Essex CO15 2NB,CO15 2NB,tonycurtis@nhs.net
Northamptonshire Teaching PCT,Eskdaill Medical Centre,Prospect House 121 Lower Street Kettering Northamptonshire NN16 8DN,NN16 8DN,Carol.bryceland@gp-k83013.nhs.uk
Barnsley PCT,Barnsley Primary Care Clinic,Mount Pleasant West Street Barnsley South Yorkshire S70 5NT,S70 5NT,AdminBPCC@BarnsleyPCT.nhs.uk
Camden PCT,Fortune Green Practice,80 Fortune Green Road London NW6 1DS,NW6 1DS,fortunegreensurgery@nhs.net
Manchester PCT,Ashville Surgery,171 Upper Chorlton Road Whalley Range Manchester M16 9RT,M16 9RT,man-pct.ashville@nhs.net
Rotherham PCT,The Chantry Bridge Medical Centre,Rotherham Community Health Centre Greasbrough Road Rotherham England - Uk S60 1RY,S60 1RY,enquries.chantrybridgegp@nhs.net
North Lancashire Teaching PCT,Galgate Health Centre,Galgate Health Centre Highland Brow Galgate Lancaster LA2 0NB,LA2 0NB,rosebank.surgery@gp81056.nhs.uk
Berkshire East PCT,Kings Corner Surgery,Kings Road Sunninghill Ascot Berkshire SL5 0AE,SL5 0AE,kingscorner@nhs.net
Surrey PCT,St David's Family Practice,Stanwell Health & Community Centre Hadrian Way Stanwell Middlesex TW19 7HE,TW19 7HE,stdavids.surgery@nhs.net
Somerset PCT,South Petherton Surgery,West Street South Petherton Somerset England - Uk TA13 5DQ,TA13 5DQ,john.hayes@martocksurgery.nhs.uk
Leicestershire County and Rutland PCT,Dr D A J Ker & Partners,Cold Overton Road Oakham Leics LE15 6NT,LE15 6NT,dr@oakhampractice.freeserve.co.uk
Bedfordshire PCT,Goldington Avenue Surgery,85 Goldington Avenue Bedford Beds Beds MK40 3DB,MK40 3DB,goldingtonavdrs@nhs.net
South Staffordshire PCT,Dr A R Webb & Partners,High Street Cheslyn Hay Walsall Staffordshire WS6 7AB,WS6 7AB,locheebayne.surgery@nhs.net
Eastern and Coastal Kent PCT,Dr Setty M V S,85 Kilndown Close Stanhope Ashford Kent TN23 5SU,TN23 5SU,pplester@nhs.net
Sheffield PCT,Deepcar Medical Centre,271 Manchester Road Deepcar Sheffield South Yorkshire S36 2RA,S36 2RA,suelambert@nhs.net
Hull Teaching PCT,East Park Practice,700 Holderness Road Hull HU9 3JA,HU9 3JA,teresa.mountain@gp-b81645.nhs.uk
County Durham PCT,West Cornforth Medical Centre,Reading Street West Cornforth Ferryhill Co Durham DL17 9LH,DL17 9LH,Linda.mccann@gp-A83634.nhs.uk
Lambeth PCT, Streatham Common Group Practice,St Andrew's Hall Guildersfield Road Streatham London SW16 5LS,SW16 5LS,louise.upton@nhs.net
Sheffield PCT,Dr R Mehrotra and Dr G Okoko,400 Richmond Road Sheffield S Yorkshire S13 8LZ,S13 8LZ,anneriley@nhs.net
Derbyshire County PCT,Dr COX & MARK  -  Litton Branch Surgery,"Litton Branch Surgery, Litton Village Hall Litton Nr Buxton Derbyshire SK17 8QP",SK17 8QP,admin.tideswellsurgery@nhs.net
Suffolk PCT,Gipping Valley Practice,Norwich Road Barham Suffolk IP6 0DJ,IP6 0DJ,mail@gippingvalleypractice.co.uk
Eastern and Coastal Kent PCT,Dr Bahadur T,Tara The Droveway St Margarets Bay Dover Kent CT15 6BT,CT15 6BT,sue.thatcher@gp-G82700.nhs.uk
Derbyshire County PCT,Appletree Medical Practice - Little Eaton,10 The Town Little Eaton Derby Derbyshire DE21 5DH,DE21 5DH,dco-pct.reception@nhs.net
Barking and Dagenham PCT,Porters Avenue Doctors' Surgery,234 Porters Avenue Becontree Dagenham Essex England - Uk RM8 2EQ,RM8 2EQ,portersavenuedoctors@nhs.net
Central Lancashire PCT,Croston Medical Centre,Croston Medical Centre 30 Brookfield Croston Leyland Lancashire PR26 9HY,PR26 9HY,Glennys.Parr@gp-P81173.nhs.uk
Norfolk PCT,Drs Hahn & Chilenge,The Green Shipdham Thetford Norfolk IP25 7LA,IP25 7LA,stuart.martin@gp-d82100.nhs.uk
South Staffordshire PCT,Dr M Murugan,Station Road Hednesford Cannock Staffordshire England - Uk WS12 4DH,WS12 4DH,murugans.surgery@nhs.net
South Staffordshire PCT,The Cloisters Medical Practice,Greenhill Health Centre Church Street Lichfield Staffordshire WS13 6JL,WS13 6JL,cloisters.practice@nhs.net
Eastern and Coastal Kent PCT,Dr Akyol A & Partners,100 Newington Road Ramsgate Kent CT12 6EW,CT12 6EW,administrator@gp-G82150.nhs.uk
Calderdale PCT,Longroyde Surgery,38 Castle Avenue Brighouse W Yorkshire HD6 3HT,HD6 3HT,joanne.kellett@gp-b84623.nhs.uk
Islington PCT,Stroud Green Medical Clinic,181 Stroud Green Road Finsbury Park London N4 3PZ,N4 3PZ,stroudgreenreception@nhs.net
Nottingham City PCT,Dr Khashayar Ghaharian,Wollaton Vale Health Centre Wollaton Vale Nottingham Nottinghamshire NG8 2GR,NG8 2GR,seyed.roshanmonir@gp-c84635.nhs.uk
Plymouth Teaching PCT,Hyde Park Surgery,2 Hyde Park Road Mutley Plymouth Devon PL3 4RJ,PL3 4RJ,enquiries.hydepark@nhs.net
Sefton PCT,THE GRANGE SURGERY,41 York Road Birkdale Southport Merseyside PR8 2AD,PR8 2AD,nina.price@gp-n84024.nhs.uk
Buckinghamshire PCT,The Rycote Practice...,East Street Thame England - Uk OX9 3JZ,OX9 3JZ,therycotepractice@nhs.net
South West Essex PCT,Dr A J L Holman,32 Knights Basildon Essex SS15 5LE,SS15 5LE,andrew.holman@nhs.net
Gloucestershire PCT,Dr J A Brooke And Partner,Barnwood Medical Practice 51 Barnwood Road Gloucester GL2 0SE,GL2 0SE,barnwood.secretary@glos.nhs.uk
East Sussex Downs and Weald PCT,Dr Brown G C & Partners,Bolton House 10 Bolton Road Eastbourne BN21 3JY,BN21 3JY,boltonhouse@nhs.net
Somerset PCT,Yeovil Health Centre,37 Middle Street Yeovil Somerset England - Uk BA20 1LS,BA20 1LS,info@yeovilhealthcentre.nhs.uk
Luton PCT,Whipperley Medical Centre,Whipperley Medical Centre Whipperley Ring Luton Beds LU1 5QY,LU1 5QY,rubee.ahmed@nhs.net
Worcestershire PCT,Dr R W Davenport & Partners,The Dow Surgery William Street Redditch Worcestershire B97 4AJ,B97 4AJ,see website
Somerset PCT,Milborne Port Surgery,Gainsborough Milborne Port Sherborne Dorset Dorset DT9 5FH,DT9 5FH,carol.hunt@milborneport.nhs.uk
Milton Keynes PCT,Milton Keynes Village Practice,Griffith Gate Middleton Milton Keynes Bucks MK10 9BQ,MK10 9BQ,mkvprequests@mkpct.nhs.uk
Northamptonshire Teaching PCT,Dr M.R.Jameel-WFHC,Billing Brook Road Weston Favell Northampton Northamptonshire NN3 8DW,NN3 8DW,janet.andreoli@gp-k83076.nhs.uk
Surrey PCT,Dr  P Loxton And Partners,Packers Christchurch Road Virginia Water Surrey GU25 4RL,GU25 4RL,linda.smit@nhs.net
Hampshire PCT,The Andover Health Centre Medical Practice,Charlton Road Andover Hampshire SP10 3LD,SP10 3LD,andoverhc@nhs.net
Dorset PCT,The Bridges Medical Centre,26 Commercial Road Weymouth Dorset DT4 7DW,DT4 7DW,thebridgesmedicalcentre@gp-j81073.nhs.uk
County Durham PCT,Dr Fairlamb & Partners,Front Street West Wingate County Durham TS28 5PZ,TS28 5PZ,dawn.nelson@gp-a83042.nhs.uk
Sefton PCT,EASTVIEW SURGERY,81 Crosby Road North Waterloo Liverpool L22 4QD,L22 4QD,NONE
Kirklees PCT,Batley Health Centre,130 Upper Commercial Street Batley West Yorkshire WF17 5DH,WF17 5DH,reception@gp-b85008.nhs.uk
Blackpool PCT,Bloomfield Medical Centre,Bloomfield Medical Centre 118-120 Bloomfield Road Blackpool Lancashire FY1 6JW,FY1 6JW,bloomfield.medical@nhs.net
Norfolk PCT,Southgates Medical and Surgical Centre,41 Goodwins Road Kings Lynn Norfolk PE30 5QX,PE30 5QX,emma.batchelor@nhs.uk
Doncaster PCT,Lyndhurst,Lyndhurst Church Road Stainforth Doncaster DN7 5PW,DN7 5PW,reception@gp-c86603.nhs.uk
Derbyshire County PCT,Dr H R McMurray and Dr S Lloyd,The Health Centre Gosber Road Eckington S Yorkshire S21 4BZ,S21 4BZ,emmett.carr@nhs.net
Kirklees PCT,Lockwood Surgery,3 Meltham Road Lockwood Huddersfield W Yorkshire HD1 3XH,HD1 3XH,colin.drake@gp-b85641.nhs.uk
Hampshire PCT,The Arnewood Practice,Milton Medical Centre Avenue Road New Milton Hampshire BH25 5JP,BH25 5JP,hamp-pct.arnewooddoctors@nhs.net
Redbridge PCT,Ilford Medical Centre,Ilford Medical Centre 61 Cleveland Road Ilford Essex IG1 1EE,IG1 1EE,ilfordmedicalcentre@nhs.net
Derbyshire County PCT,TALEB SM,Burton Road Woodville Swadlincote Derbyshire DE11 7JG,DE11 7JG,admin.woodville@nhs.net
Lambeth PCT,Dr Curran & Partners,The Manor Health Centre 86 Clapham Manor Street London SW4 6EB,SW4 6EB,lam-pct.drcurran-EHS@nhs.net
Hampshire PCT,Broughton Surgery [Training Practice],School Lane Broughton Hampshire SO20 8BZ,SO20 8BZ,hamp-pct.Stockbridge@nhs.net
Derbyshire County PCT,The Surgery The Green,The Surgery The Green Glapwell Chesterfield Derbys S44 5LW,S44 5LW,general.drspencer@nhs.net
Lincolnshire Teaching PCT,Dr Gibbs And Partners,Minster Medical Practice 2 Cabourne Court Cabourne Avenue Lincoln LN2 2JP,LN2 2JP,minster.secretaries@lpct.nhs.uk
