pct,name,addr,postcode,email
South Staffordshire PCT,Dr J Eames & Partners,Mansion House Abbey Street Stone Staffs ST15 8YE,ST15 8YE,mansion.house@nhs.net
Brighton and Hove City PCT,Dr Burrow and Partners,Regency Surgery 4 Old Steine  Brighton BN1 1FZ,BN1 1FZ,joyce.howfield@nhs.net or brian.pichanick@nhs.net
Norfolk PCT,Oak Street Medical Practice,Oak Street Norwich Norfolk NR3 3DL,NR3 3DL,oakstreet.practicenorwich@nhs.net
Wakefield District PCT,The Clinic Emley Branch Dr Gair & Partners,The Clinic The Crofts Emley West Yorkshire HD8 9RU,HD8 9RU,middlestown.surgery@nhs.net
South Staffordshire PCT,Dr V K Singh,Station Road Hednesford Cannock Staffordshire England - Uk WS12 4DH,WS12 4DH,escrett.street@nhs.net
Surrey PCT,Dr COUCH & partners,Studholme Medical Centre 50 Church Road Ashford Middlesex TW15 2TU,TW15 2TU,Practice@gp-h81009.nhs.uk
Derbyshire County PCT,ASHOVER MEDICAL CENTRE,Milken Lane Ashover Chesterfield S45 0BA,S45 0BA,admin.ashoversurgery@nhs.net
Suffolk PCT,"Head, Fenning, Herman & Tanna",Chapel Road Mendlesham Stowmarket Suffolk IP14 5SQ,IP14 5SQ,receptionists@gp-d83019.nhs.uk
Enfield PCT,Green Cedars Medical Centre,93-95 Silver Street Upper Edmonton London N18 1RP,N18 1RP,enf-pct.GreenCedarsMedicalCentre@nhs.net
Great Yarmouth and Waveney PCT,Dr Gould & Dr Lal,55 King Street Great Yarmouth Norfolk NR30 2PW,NR30 2PW,surgery@55kingstreet.freeserve.co.uk
Bradford and Airedale Teaching PCT,Drs Booth & Welford,Carlton Medical Practice Girlington Health Centre 195 Girlington Road Bradford BD8 9PB,BD8 9PB,carlton@bradford.nhs.uk
Doncaster PCT,Bessacarr Medical Centre,Bessacarr Medical Centre 36 Nostell Place Bessacarr Doncaster DN4 7JA,DN4 7JA,themountgroup.practice@gp-c86011.nhs.uk
Walsall Teaching PCT,THOMAS,Gomer Street Willenhall West Midlands WV13 2DR,WV13 2DR,croftsurgery@walsall.nhs.uk
Hertfordshire PCT,HEDGES JR,Melbourn Street Royston Herts SG8 7BS,SG8 7BS,enquiries.roystonhc@nhs.net
Liverpool PCT,STANLEY MEDICAL CENTRE,60 Stanley Road Kirkdale Liverpool Merseyside L5 2QA,L5 2QA,S.Sharma@GP.N82060.nhs.uk
Devon PCT,Bramblehaies Surgery (Bramblehaies Partnership),College Road Cullompton Devon EX15 1TZ,EX15 1TZ,d-pc.bramblehaies@nhs.net
Solihull PCT,THE VILLAGE SURGERY,Cheswick Green Shirley Solihull West Midlands B90 4JA,B90 4JA,villagesurgery@nhs.net
Doncaster PCT,Barnburgh Surgery,Fox Lane Barnburgh Doncaster South Yorkshire South Yorkshire DN5 7ET,DN5 7ET,barnburghsurgery@gp-c86606.nhs.uk
South West Essex PCT,Dr R Das Gupta,24 The Pantiles Billericay Essex CM12 0UA,CM12 0UA,admin.mailboxf81222@nhs.net
Luton PCT,Moakes Medical Centre,"Marsh Farm Health Centre The Purley Centre The Moakes, Luton Bedfordshire LU3 3SR",LU3 3SR,lorraine.swain@nhs.net
Surrey PCT,Coulter & Partners,The Surgery Station Road Frimley Camberley Surrey GU16 7HG,GU16 7HG,dgubbins@nhs.net
Suffolk PCT,Meadow Lane Surgery,Hardwicke House Group Practice Meadow Lane Sudbury Suffolk CO10 2TD,CO10 2TD,david.cripps@nhs.net
Sefton PCT,LINCOLN HOUSE SURGERY,33 Lincoln Road Southport Merseyside PR8 4PR,PR8 4PR,sandra.guppy@gp-n84037.nhs.uk
North Lincolnshire PCT,Dr Kennedy & Partners - Detuyll St,20 Detuyll Street Scunthorpe Lincolnshire DN15 7LS,DN15 7LS,nl.b81026@nhs.net
Northamptonshire Teaching PCT,Danetre Medical Practice,London Road Daventry Northants NN11 4DY,NN11 4DY,ruth.farthing@gp-k83015.nhs.uk
Dorset PCT,Royal Crescent Surgery,Royal Crescent Surgery 25 Crescent Street Weymouth Dorset DT4 7BY,DT4 7BY,receptionist@gp-j81027.nhs.uk
South Staffordshire PCT,Vyse A E J,Gravel Hill Wombourne Wolverhampton Staffordshire WV5 9HA,WV5 9HA,gravel.hill@nhs.net
Brighton and Hove City PCT,Dr Mancy-Barratt & Partner,The Surgery 18 Hove Park Villas Hove BN3 6HG,BN3 6HG,jill.sinclair@nhs.net
Hampshire PCT,Chawton House Surgery,43-45 St Thomas Street Lymington Hampshire SO41 9ND,SO41 9ND,hamp-pct.chawtonhouse@nhs.net
Oldham PCT,CH Medical,Fields New Road Primary Care Centre Chadderton Oldham Gtr Manchester OL9 8NH,OL9 8NH,olp-pct.p85011@nhs.net
Hartlepool PCT,Hartfields Medical Centre,Hartfields Extra Care Village Hartfields Manor Hartlpool Cleveland England - Uk TS26 0US,TS26 0US,donnamcilwrath@nhs.net
Southampton City PCT,Bitterne Park Surgery,Bitterne Park Surgery Bitterne Medical Centre Thorold Road Southampton Hampshire SO18 1HZ,SO18 1HZ,helen.whatmore@nhs.net
Hertfordshire PCT,Dr Isaac & Partners,Vine House Health Centre 87-89 High Street Abbots Langley WD5 0AJ,WD5 0AJ,confidential.vinehouse@nhs.net
Hampshire PCT,Middle Park Medical Centre,Middle Park Surgery 15 Middle Park Way Leigh Park Havant Hampshire PO9 4AB,PO9 4AB,ramzie.wafai@nhs.net
Kingston PCT,BRUNSWICK SURGERY,Brunswick Surgery Oakhill Health Centre Oakhill Road Surbiton Surrey KT6 6EN,KT6 6EN,david.potton@nhs.net
Wandsworth PCT,P J Ilves,351 Danebury Avenue Roehampton London SW15 4DU,SW15 4DU,marja.moffat@nhs.net
East Lancashire Teaching PCT,Dr A Y Kapenda Abbey Surgery,60 Abbey Street Accrington Lancashire BB5 1EE,BB5 1EE,abbeysurgery@nhs.net
North Staffordshire PCT,Higherland Surgery,Higherland Surgery 3 Orme Road Poolfields Newcastle Staffs ST5 2UE,ST5 2UE,colin.storey@northstaffs.nhs.uk
Norfolk PCT,Dr Hadley-Brown & Partners,School Lane Thetford Norfolk IP24 2AG,IP24 2AG,mhb@slsthetford.freeserve.co.uk
Somerset PCT,Wellington Medical Centre (Dr Rickard & Partners),Wellington Medical Centre Mantle Street Wellington Somerset TA21 8BD,TA21 8BD,Reception.Office@wellingtonmc.nhs.uk
Sunderland Teaching PCT,Dr Vakharia & Dr Hegde,The Galleries Washington Tyne and Wear Tyne and Wear NE38 7NQ,NE38 7NQ,info@drvandhonline.com  
Berkshire West PCT,Eldon Road Surgery,10 Eldon Road Reading Berks RG1 4DH,RG1 4DH,eldon.surgery@nhs.net
Lambeth PCT,Dr Irani,204 Kennington Lane London SE11 5DN,SE11 5DN,iranipractice@nhs.net
Cumbria Teaching PCT,Grosvenor House Surgery,Grosvenor House Warwick Square Carlisle Cumbria CA1 1LB,CA1 1LB,www.grosvenorhousesurgery.co.uk
Northamptonshire Teaching PCT,Grange Park Surgery,Wilks Walk Grange Park Northampton Northamptonshire England - Uk NN4 5DW,NN4 5DW,karen.day@gp-k83052.nhs.uk
Derbyshire County PCT,Toton Branch Surgery,2 Banks Road Toton Nottingham NG9 6HD,NG9 6HD,dco-pct.C81010-Toton-Recept@nhs.net
Worcestershire PCT,Hollywood Medical Practice,Beaudesert Road Hollywood Birmingham B47 5DP,B47 5DP,hollywood.adminteam@nhs.net
Wirral PCT,THE VILLA MEDICAL CENTRE,The Villa Medical Centre Roman Road Prenton Wirral CH43 3DB,CH43 3DB,WIR-PCT.THEVILLAMEDICALCENTRE@NHS.NET
County Durham PCT,Leadgate Surgery,"George Ewen House Watling Street Leadgate, Consett Co Durham DH8 6DP",DH8 6DP,helen.arden@gp-A83636.nhs.uk
County Durham PCT,Peaseway Medical Centre,2 Pease Way Newton Aycliffe Co Durham DL5 5NH,DL5 5NH,mikespence@nhs.net
South Staffordshire PCT,Aldridge R V H,School House Lane Abbots Bromley Rugeley Staffs WS15 3BT,WS15 3BT,Sudbury.surgery@sshawebmail.nhs.uk
Lincolnshire Teaching PCT,Dr Babbs And Partners,St Mary's Medical Centre Wharf Road Stamford Lincs PE9 2DH,PE9 2DH,vanessa.coates@lpct.nhs.uk
Bournemouth and Poole Teaching PCT,The Harvey Practice,81 Merley Lane Wimborne Dorset BH21 3BB,BH21 3BB,drs@theharveypractice.co.uk
Solihull PCT,Solihull Healthcare & Walk in Centre,Lode Lane Solihull West Midlands England - Uk B91 2AE,B91 2AE,solihullwic@nhs.net
County Durham PCT,Dr Mansour,Suite No. 2 Bede Way Peterlee County Durham SR8 1AD,SR8 1AD,dr.mansour@gp-a83619.nhs.uk
Central and Eastern Cheshire PCT,Dr Kelly DP and Partners,Weaver Vale Surgery Dene Drive Primary Care Centre Dene Drive Winsford Cheshire Cheshire CW7 1AT,CW7 1AT,val.callow@gp-n81127.nhs.uk
Redbridge PCT,Spearpoint Surgery - Pooled List,Spearpoint Surgery 1 Spearpoint Gardens Aldborough Road North Newbury Park IG2 7SX,IG2 7SX,hilary.powell1@nhs.net
Sandwell PCT,The Practice Old Hill,Priest House Priest Street Cradley Heath West Midlands B64 6JN,B64 6JN,m88016.prescriptions@nhs.net
Sheffield PCT,Park Health Centre,190 Duke Street Sheffield S Yorkshire S2 5QQ,S2 5QQ,Lynda.Hall@gp-C88042.nhs.uk
West Sussex PCT,Westcourt Surgery,Westcourt Medical Centre 12 The Street Rustington Littlehampton West Sussex BN16 3NX,BN16 3NX,w.admin@nhs.net
South Staffordshire PCT,The Westgate Practice,Church Street Lichfield Staffordshire WS13 6JL,WS13 6JL,westgate.westgate@nhs.net
Brighton and Hove City PCT,Dr Adolfo Gracia,Ship Street Surgery 65-67 Ship Street Brighton BN1 1AE,BN1 1AE,shipstreetsurgery@nhs.net
Surrey PCT,Dr J Mellor & Partners,"Knaphill Surger Redding Way, Knaphill Woking Surrey GU21 2DN",GU21 2DN,heathcotmedicalpractice@nhs.net
Somerset PCT,Tawstock Medical Centre,7 High Street Chard Somerset TA20 1QF,TA20 1QF,general@tawstockmedicalcentre.nhs.uk
Dorset PCT,Crossways Health Centre,Old Farm Way Crossways Dorchester Dorset DT2 8TU,DT2 8TU,postmaster@gp-J81068.nhs.uk
Havering PCT,Dr H Hussain,Upminster Road South Rainham Essex RM13 9AB,RM13 9AB,annettepeck@nhs.net
Bristol PCT,Horfield Health Centre,Lockleaze Road Horfield Bristol BS7 9RR,BS7 9RR,horfield@gp-L81022.nhs.uk
Herefordshire PCT,Sarum House,3 St Ethelbert Street Hereford Herefordshire HR1 2NS,HR1 2NS,sarum.mail@nhs.net
Wiltshire PCT,Beversbrook Medical Centre,Beversbrook Medical Centre Harrier Close Calne Wiltshire SN11 9UT,SN11 9UT,beversbrook@nhs.net
Northamptonshire Teaching PCT,Dr Sumira,Studfall Court Corby Northamptonshire NN17 1QP,NN17 1QP,anna.lewis@gp-k83607.nhs.uk
Cambridgeshire PCT,"Maple Surgery, Bar Hill Health Centre",Hanover Close Bar Hill Cambridge Cambs CB23 8EH,CB23 8EH,maplesurgery.enquiries@nhs.net
Warwickshire PCT,Rother House Medical Centre,Alcester Road Stratford-upon-Avon Warwickshire CV37 6PP,CV37 6PP,http://www.rotherhouse.co.uk/index.php?option=com_forme&Itemid=96
Norfolk PCT,Narborough branch of Dr Haczewski & Partners,Main Road Narborough Swaffham Norfolk PE32 1TE,PE32 1TE,carol.bantick@nhs.net
Kingston PCT,Canbury Medical Centre,Canbury Medical Centre 1 Elm Road Kingston-upon-Thames Surrey KT2 6HR,KT2 6HR,prakash.karsan@nhs.net
Bolton PCT,Dr Caswell,108 Crescent Road Great Lever Bolton Lancs BL3 2JR,BL3 2JR,beehive.surgery@nhs.net
Derbyshire County PCT,Dr ANDERSON & partners,Avenue House Surgery 109 Saltergate Chesterfield Derbyshire S40 1LE,S40 1LE,admin.avenuehouse@nhs.net
Havering PCT,Oak Lodge Surgery,6 Oak Road Harold Wood Essex RM3 0PT,RM3 0PT,debabrata.chowdhury@nhs.net
Suffolk PCT,Hardwicke House Group Practice,Stour Street Sudbury Suffolk CO10 2AY,CO10 2AY,david.cripps@nhs.net
Havering PCT,Mawney Medical Centre,7 St. Edwards Way Romford Essex RM1 3DQ,RM1 3DQ,mawneymed@aol.com
Doncaster PCT,Conisbrough Group Practice,The Health Centre Gardens Lane Conisbrough Doncaster DN12 3JW,DN12 3JW,conisbrough.grouppractice@gp-c86024.nhs.uk
Sefton PCT,Dr C DORAN & PARTNER,20 Kingsway Waterloo Liverpool Merseyside L22 4RQ,L22 4RQ,NONE
Medway PCT,Dr Ramesh N,Railside Surgery 7 Railway Street Gillingham Kent ME7 1XG,ME7 1XG,renu.evans@nhs.net
Wirral PCT,HAMILTON MEDICAL CENTRE,86 Market Street Birkenhead Merseyside CH41 6AJ,CH41 6AJ,wir-pct.hamilton@nhs.net
Mid Essex PCT,Clements House Surgery,"Clements House, Knight Street South Woodham Ferrers Chelmsford Essex Essex CM3 5ZL",CM3 5ZL,soumyo.gorai@gp-f81677.nhs.uk
South East Essex PCT,The Pall Mall Surgery ,"1st Floor, Leigh Primary Care Centre 918 London Road Leigh-on-Sea Essex SS9 3NG",SS9 3NG,pallmallsurgery@nhs.net
Warwickshire PCT,Waterside Medical Centre,Court Street Leamington Spa Warks CV31 2BB,CV31 2BB,admin@watersidemc.nhs.uk
Cambridgeshire PCT,"Dr Irwin & Partners, Little Paxton Surgery",40 High Street Little Paxton St. Neots Cambs PE19 6EY,PE19 6EY,bandlp@nhs.net
South Staffordshire PCT,Dr A Yi,Station Road Hednesford Cannock Staffordshire England - Uk WS12 4DJ,WS12 4DJ,angleseystreet.surgery@nhs.net
Cambridgeshire PCT,Gt Staughton Surgery,57 The Highway Great Staughton St Neots Cambs PE19 5DA,PE19 5DA,greatstaughton@nhs.net
Buckinghamshire PCT,Carrington House Surgery,19 Priory Road High Wycombe Bucks HP13 6SL,HP13 6SL,carrington.house@nhs.net
Sheffield PCT,Rustlings Road Medical Centre,105 Rustlings Road Sheffield South Yorkshire S11 7AB,S11 7AB,chris.nicol@nhs.net
Westminster PCT,King's College NHS Health Centre,3rd Floor Macadam Building Surrey Street London WC2R 2LS,WC2R 2LS,kingscollegehc.wpct@nhs.net
Croydon PCT,QUEENHILL MEDICAL PRACTICE,31 Queenhill Road Selsdon South Croydon Surrey CR2 8DU,CR2 8DU,cro-pct.H83014Prescriptions@nhs.net
Norfolk PCT,Necton branch of Dr Haczewski & Partners,North Pickenham Road Necton Swaffham Norfolk PE37 8EF,PE37 8EF,carol.bantick@nhs.net
Derby City PCT,WILSON STREET SURGERY,11 Wilson Street Derby DE1 1PG,DE1 1PG,wilsonstreetsurgery@nhs.net
West Sussex PCT,Leacroft Medical Practice,"Langley House, Langley Drive Langley House Langley Drive Crawley West Sussex RH11 7TF",RH11 7TF,ws-pct.leacroft@nhs.net
County Durham PCT,Blackhall & Peterlee Practice,O'Neil Drive Peterlee County Durham SR8 1AD,SR8 1AD,gillianmagee@nhs.net
Norfolk PCT,Magdalen Medical Practice,Lawson Road Norwich Norfolk NR3 4LF,NR3 4LF,garry@nhs.net
Norfolk PCT,Dr Tasker & Partners,County Court Road King's Lynn Norfolk PE30 5SY,PE30 5SY,sjmp@globalnet.co.uk
Leicestershire County and Rutland PCT,Dr M K Lakhani,5 Storer Close Sileby Loughborough Leics LE12 7UD,LE12 7UD,MK.Lakhani@gp-c82644.nhs.uk
Milton Keynes PCT,Westcroft Health Centre,1 Savill Lane Westcroft Milton Keynes MK4 4EN,MK4 4EN,westcroftmc@nhs.net
South Staffordshire PCT,Stretton Medical Centre,Ladywell Close Stretton Burton On Trent Staffordshire DE13 0FS,DE13 0FS,stretton.medical@nhs.net
Warrington PCT,Lakeside Surgery,Lakeside Road Lymm Cheshire WA13 0QE,WA13 0QE,war-pct.lakesidemc@nhs.net
Eastern and Coastal Kent PCT,Dr Mohammed Y I,Hollington Surgery Blue Line Lane Ashford Kent TN24 8UN,TN24 8UN,hollingtonsurgery@nhs.net
West Kent PCT,Swanscombe Health,Greenhithe Surgery 32 London Road Greenhithe Kent DA9 9EJ,DA9 9EJ,beverley.Johnson4@nhs.net
North Yorkshire and York PCT,Beech House Surgery,1 Ash Tree Road Knaresborough North Yorkshire HG5 0UB,HG5 0UB,surgery@gp-B82069.nhs.uk
Dorset PCT,Pennys Hill Practice,Ferndown Medical Centre St. Marys Road Ferndown Dorset BH22 9HB,BH22 9HB,pennyshill.practice@dorset.nhs.uk
"Ashton, Leigh and Wigan PCT",Dr J D Seabrook & Partner,1 Wrightington Street Wigan Lancs WN1 2AZ,WN1 2AZ,joyce.lewis@gp-p92030.nhs.uk
South Staffordshire PCT,Moss Grove Surgery Kinver,Kinver Health Centre High Street Kinver Stourbridge DY7 6HL,DY7 6HL,kinver.practice@sshawebmail.nhs.uk
North Yorkshire and York PCT,"Dr Enevoldson & Partners, Mayford House Surgery",Mayford House Surgery Boroughbridge Road Northallerton DL7 8AW,DL7 8AW,secretaries@gp-b82075.nhs.uk
Tameside and Glossop PCT,Millbrook Medical Practice,Hollybank Off Grove Road Stalybridge Lancs SK15 3BJ,SK15 3BJ,millbrookmedical@nhs.net
Somerset PCT,Harley House Surgery,2 Irnham Road Minehead Somerset TA24 5DL,TA24 5DL,janet.hewlett@harleyhouse.nhs.uk
Lincolnshire Teaching PCT,The Marisco Medical Practice,The Marisco Medical Practice Stanley Avenue Mablethorpe Lincs LN12 1DP,LN12 1DP,Lin-pct.MariscoReception@nhs.net
Leeds PCT,"Guiseley & Yeadon Medical Practice, Yeadon Community Health Centre",Yeadon Health Centre South View Road Yeadon LS19 7PS,LS19 7PS,admin.yhc@nhs.net
Liverpool PCT,Picton Medical & Children Centre,137 Earle Road Liverpool Merseyside L7 6HD,L7 6HD,Pushpa.Yadav@gp-n8266.nhs.uk
South Staffordshire PCT,The Langton Medical Group (Whittington),"Whittington Village Hall Langton Crescent Whittington, Lichfield Staffordshire WS14 9LR",WS14 9LR,langton.medical@sshawebmail.nhs.uk
West Essex PCT,Kings Medical Centre,23 Kings Avenue Buckhurst Hill Essex IG9 5LP,IG9 5LP,we-pct.kmc@nhs.net
South Staffordshire PCT,Dr P S Harrison & Partners,Albert Road Fazeley Tamworth Staffordshire B78 3JQ,B78 3JQ,albert.road@sshawebmail.nhs.uk
Sutton and Merton PCT,The Knoll,The Knoll Parkside Cheam Sutton Surrey SM3 8BS,SM3 8BS,The practice does not have email facility for patients
Greenwich Teaching PCT,Welling Medical Surgery,2 Falconwood Parade The Green Welling Kent DA16 2PL,DA16 2PL,johanna.randall@nhs.net
Leicester City PCT,The Practice Beaumont Leys,1 Little Wood Close Leicester Leics LE4 0UZ,LE4 0UZ,info@thepracticeplc.com
Enfield PCT,Gillan House ,Gillan House Surgery 457 Green Lanes Palmers Green London N13 4BS,N13 4BS,enf-pct.gillanhouse@nhs.net
West Kent PCT,Dr Arora R P,111 Summerhouse Drive Joydens Wood Bexley Kent DA5 2ER,DA5 2ER,wk-pct.joydens@nhs.net
Hertfordshire PCT,Fernville  ,Fernville Surgery Midland Road Hemel Hempstead Herts HP2 5BL,HP2 5BL,Contact.Fernville@gp-E82022.nhs.uk
Northamptonshire Teaching PCT,Rothwell Surgery,109 Desborough Road Kettering Rothwell Northamptonshire NN14 6JQ,NN14 6JQ,norman.gray@gp-k83021.nhs.uk
Lincolnshire Teaching PCT,Caythorpe & Ancaster Medical Practice (Caythorpe),Caythorpe Surgery 52 High Street Caythorpe Grantham NG32 3DN,NG32 3DN,enquiries@villagedoctor.co.uk
Coventry Teaching PCT,Morris Avenue Surgery,36 Morris Avenue Wyken Coventry West Midlands CV2 5GX,CV2 5GX,morrisadmin@nhs.net
Mid Essex PCT,Dr N Parry-Jones & Partner,Douglas Grove Witham Essex CM8 1TE,CM8 1TE,administration@gp-f81173.nhs.uk
Surrey PCT,STANWELL ROAD SURGERY,95 Stanwell Road Ashford Middlesex Ashford TW15 3EA,TW15 3EA,stanwell.road@nhs.net
Liverpool PCT,EDGE HILL HEALTH CENTRE,Crosfield Road Liverpool Merseyside L7 5QL,L7 5QL,Sue.Haton@GP-N82022.NHS.UK
Leicestershire County and Rutland PCT,"Charnwood Medical Group, Storer Road Surgery",Rosebery Medical Centre Rosebery Street Loughborough Leics LE11 5DX,LE11 5DX,lcr-pct.charnwoodmedicalgroup@nhs.net
Liverpool PCT,DHARMANAS FAMILY AND GENERAL PRACTICE,97 Queens Drive Walton Liverpool L4 6SG,L4 6SG,B.Chakrabarti@GP-N82657.NHS.UK
Coventry Teaching PCT,JUBILEE HEALTHCARE,41 Westminster Road Earlsdon Coventry West Midlands CV1 3GB,CV1 3GB,info.jubileehc@nhs.net
Herefordshire PCT,Mortimer Medical Centre - Croase Orchard Surgery,Kingsland Leominster Herefordshire HR6 9QL,HR6 9QL,gene.clark@nhs.net
Cornwall and Isles Of Scilly PCT,Grampound Surgery,The Surgery Mill Lane Grampound Cornwall TR2 4RU,TR2 4RU,enquiries@probus.cornwall.nhs.uk
North Lancashire Teaching PCT,Over Wyre Medical Centre,Hambleton Health Centre Hambleton Poulton-le-Fylde Lancashire FY6 9AH,FY6 9AH,john.macphee@nhs.net
Sheffield PCT,Gleadless Medical Centre,636 Gleadless Road Sheffield South Yorkshire S14 1PQ,S14 1PQ,Stella.Crookes@nhs.net
Bolton PCT,The Olive Family Practice,The Olive Family Practice The Pikes Lane Centre Deane Road Bolton BL3 5HP,BL3 5HP,olivefp@nhs.net
Cumbria Teaching PCT,Queen Street Medical Practice,Richard Benedict House 149 Queen Street Whitehaven Cumbria CA28 7BA,CA28 7BA,reception@gp-a82058.nhs.uk
Ealing PCT,Featherstone Road Health Centre,Hartington Road Southall Middlesex England - UK UB2 5BQ,UB2 5BQ,eal-pct.FeatherstoneRoadHC@nhs.net
Wolverhampton City PCT,Ettingshall Medical Centre,Herbert Street Ettingshall Wolverhampton West Midlands WV14 0NF,WV14 0NF,ettingshall.medicalcentre@wolvespct.nhs.uk
Northamptonshire Teaching PCT,Abington Park Surgery,Christchurch Medical Centre Ardington Road Northampton Northamptonshire NN1 5LT,NN1 5LT,aps.patients@gp-k83029.nhs.uk
Norfolk PCT,Dr Boyle ,Paddock Road Harleston Norfolk IP20 9AR,IP20 9AR,panacea@doctors.org.uk
Doncaster PCT,Dr Kirupanantham & Partner,Adwick Road Mexborough South Yorkshire S64 0BY,S64 0BY,Denise.myhill@gp-c86005.nhs.uk
Somerset PCT,Exmoor Medical Centre,Oldberry House Fishers Mead Dulverton Somerset TA22 9EN,TA22 9EN,kathryn.kyle@exmoormc.nhs.uk
South Staffordshire PCT,Brereton Surgery,88 Main Road Brereton Rugeley Staffs WS15 1DU,WS15 1DU,brereton.surgery@nhs.net
Eastern and Coastal Kent PCT,Drs Johnson and Hanrath,Chartham Surgery Parish Road Chartham Canterbury Kent CT4 7JU,CT4 7JU,chartham.surgery@nhs.net
Cumbria Teaching PCT,Glenridding Health Centre,Glenridding Penrith Cumbria CA11 0PD,CA11 0PD,reception@gp-a82620.nhs.uk
Hastings and Rother PCT,Little Common Surgery - Dr Dewhurst & Partners,Little Common Surgery 82 Cooden Sea Road Little Common Bexhill-on-Sea TN39 4SP,TN39 4SP,hr-pct.littlecommonsurgery@nhs.net
Stoke On Trent PCT,Dr Shah's Surgery,New Inn Lane Hanford Stoke on Trent Staffs ST4 8EX,ST4 8EX,dr.shah@nhs.net
South Staffordshire PCT,Browning Street Surgery,10 Browning Street Stafford Staffordshire ST16 3AT,ST16 3AT,browning.street@nhs.net
Islington PCT,Dartmouth Park Practice,18 Dartmouth Park Hill London NW5 1HL,NW5 1HL,park@nhs.net
Central and Eastern Cheshire PCT,Wilmslow Health Centre,Chapel Lane Wilmslow Cheshire SK9 5HX,SK9 5HX,cec-pct.whcadmin@nhs.net
West Sussex PCT,Crawley Health Centre,Crawley Health Centre 14 Haslett Avenue West Crawley West Sussex RH10 1HS,RH10 1HS,info@crawleyhealthcentre.co.uk
Waltham Forest PCT,The Ecclesbourne Practice- DR Oraelosi and Partners  ,Ecclesbourne Warwick Terrace Lea Bridge Road Leyton E17 9DP,E17 9DP,pbeatty2@nhs.net
Gateshead PCT,"Drs Hunt, Murrell & Mather",8 Dewhurst Terrace Sunniside Newcastle Upon Tyne Tyne and Wear NE16 5LP,NE16 5LP,alan.hunt@gp-a85617.nhs.uk
Devon PCT,Chapel Platt Surgery,1901 Fore Street Topsham Devon EX3 0HE,EX3 0HE,Chapel.Platt@gp-L83661.nhs.uk
South Staffordshire PCT,Yannamani S R,Ellerbeck Wilnecote Tamworth Staffordshire B77 4JA,B77 4JA,stoneydelph.yannamani@sshawebmail.nhs.uk
Bath and North East Somerset PCT,Fairfield Park Health Centre,Fairfield Park Health Centre Tyning Lane Camden Road Bath BA1 6EA,BA1 6EA,office.staff@gp-L81071.nhs.uk
Central Lancashire PCT,Dr J S Modha,The Health Centre Sandy Lane Skelmersdale Lancashire WN8 8LA,WN8 8LA,jay.modha@gp-P81764.nhs.uk
Somerset PCT,Crown Medical Centre,Crown Medical Centre Crown Industrial Estate Venture Way Taunton Somerset TA2 8QY,TA2 8QY,claire.gregory@crownmedicalcentre.nhs.uk
West Sussex PCT,Park Surgery Horsham,The Park Surgery Albion Way Horsham West Sussex RH12 1BG,RH12 1BG,parkadmin@nhs.net
County Durham PCT,Dr K S Baliga,Church Street Shildon County Durham DL4 1DU,DL4 1DU,surendra.baliga@gp.a83638.nhs.uk
Bassetlaw PCT,Bawtry & Blyth Medical (Blyth),1 The Archway High Street Blyth Nottinghamshire S81 8EQ,S81 8EQ,bawtry.general@gp-c84101.nhs.uk
Lambeth PCT,Myatts Field Medical Practice,Akerman Health Centre 60 Patmos Road London SW9 6AF,SW9 6AF,dolina.redjimi@nhs.net
Sutton and Merton PCT,Dr Ayub & Partners,58 High Street Colliers Wood London SW19 2BY,SW19 2BY,pat.hennessy@nhs.net
Doncaster PCT,West End Clinic,West End Clinic West End Lane Rossington Doncaster DN11 0PQ,DN11 0PQ,reception@gp-c86621.nhs.uk
Worcestershire PCT,Severn Valley Medical Practice,Lyppard Grange Medical Centre Ankerage Green Off Millwood Drive Warndon Worcester WR4 0DZ,WR4 0DZ,worc-pct.gpm81006@nhs.net
South Staffordshire PCT,Pattingham Surgery,9 Wolverhampton Road Pattingham Wolverhampton WV6 7AF,WV6 7AF,pattingham.practice@nhs.net
South West Essex PCT,FRYERNS MEDICAL CENTRE,Peterborough Way BASILDON Essex SS14 3SS,SS14 3SS,pradeep.singh@nhs.net
Somerset PCT,Abbey Manor Medical Practice,Abbey Manor Park Yeovil Somerset England - Uk BA21 3TL,BA21 3TL,contact@abbeymanormp.nhs.uk
"Ashton, Leigh and Wigan PCT",Dr Spielmann & Partners,Old Henry Street Medical Centre Henry Street Leigh Lancs WN7 2PG,WN7 2PG,marily.canty@gp-p92007.nhs.uk
Medway PCT,The Sunlight Centre,The Sunlight Centre 105 Richmond Road Gillingham Kent ME7 1LX,ME7 1LX,Through the website
South Staffordshire PCT,Rawle M S,Mill Bank Surgery Water Street Stafford Staffordshire ST16 2AG,ST16 2AG,millbanksurgery@nhs.net
Sheffield PCT,Duke Medical Centre,28 Talbot Road Sheffield S Yorkshire S2 2TD,S2 2TD,dukemedicalcentre@nhs.net
Sheffield PCT,Birley Health Centre,120 Birley Lane Sheffield S Yorkshire S12 3BP,S12 3BP,birley.hc@gp-C88025.nhs.uk
Central Lancashire PCT,Regent House Surgery,Regent House Surgery 21 Regent Road Chorley Lancashire PR7 2DH,PR7 2DH,cl-pct.RegentHouseSurgery@nhs.net
Ealing PCT,Ealing Park Health Centre,195a South Ealing Road Ealing W5 4RH,W5 4RH,admin.ephc@nhs.net
Liverpool PCT,BIGHAM ROAD MEDICAL CENTRE,Bigham Road Liverpool Merseyside L6 6DW,L6 6DW,Sueallan@gp-n82671.nhs.uk
County Durham PCT,Dr Nicholson & Partners,Woodland View West Rainton Houghton-le-Spring Tyne and Wear DH4 6RQ,DH4 6RQ,brenda.hall@gp.a83024.nhs.uk
Herefordshire PCT,Moorfield House Surgery,Ross Road Hereford Herefordshire HR2 7RL,HR2 7RL,jackie.finney@gp-m81026.nhs.uk
Hertfordshire PCT,KANANI SA,34 High Street Kings Langley Herts WD4 9HT,WD4 9HT,kirstiford@nhs.net
Hastings and Rother PCT,Warrior Square Surgery,Warrior Square Surgery Marlborough House 19-21 Warrior Square St Leonards On Sea TN37 6BG,TN37 6BG,hr-pct.warriorsquaresurgery@nhs.net
Southwark PCT,Sternhall Lane Surgery,12 Sternhall Lane London SE15 4NT,SE15 4NT,sternhalllanesurgery@nhs.net
South Staffordshire PCT,Wheaton Aston Surgery,"Leabank House, The Cobbles Wheaton Aston Stafford Staffordshire ST19 9NB",ST19 9NB,brewoodsurgery@nhs.net
West Sussex PCT,Yew Tree Surgery,North End Road Yapton Arundel West Sussex BN18 0DU,BN18 0DU,Jerry.Nelson@nhs.net
Bradford and Airedale Teaching PCT,The Ridge Medical Practice 1,The Ridge Medical Centre Cousen Road Bradford West Yorkshire BD7 3JX,BD7 3JX,the.ridge@bradford.nhs.uk
Bradford and Airedale Teaching PCT,The Ridge Medical Practice 2,93 Smith Avenue Wibsey Bradford West Yorkshire BD6 1HA,BD6 1HA,the.ridge@bradford.nhs.uk
Bradford and Airedale Teaching PCT,The Ridge Medical Practice 3,"Westbourne Green Community Health Centre 50 Heaton Road Manningham, Bradford West Yorkshire BD8 8RA",BD8 8RA,the.ridge@bradford.nhs.uk
Lambeth PCT,Knights Hill Surgery,130 Knights Hill West Norwood London London SE27 0SR,SE27 0SR,lam-pct.knightshill@nhs.net
"Ashton, Leigh and Wigan PCT",Dr STH Shah,145 Elliott Street Tyldesley Manchester Lancs M29 8FL,M29 8FL,Christina.cooney@gp_p92028.nhs.uk
Central Lancashire PCT,Parbold Surgery,The Surgery The Green Parbold Wigan Lancashire WN8 7DN,WN8 7DN,jackie.tuszynski@nhs.net
